{
  "schema": "openprose.runner-dry-run-report/1",
  "wouldStartModel": false,
  "cwd": "{{WORKSPACE}}",
  "selection": {
    "harness": "mock",
    "transport": "deterministic",
    "adapterId": "mock/in-memory",
    "runtimeVersion": "1.0.0",
    "model": null
  },
  "prompt": { "placement": "developer", "strictness": "strict" },
  "isolation": "test-fixture",
  "auth": { "category": "none-test-only", "readiness": "not-applicable" },
  "billingOwner": "test-fixture",
  "languageImage": {
    "formatVersion": "openprose.skill-runtime-image/1",
    "version": "sentinel-v1",
    "sha256": "ee13d1cbba24d1623523f4fe8747b4a3387cd6880f5d6fb4a360d2a7949ddf00",
    "releaseEligible": false
  },
  "configuration": [
    { "key": "cwd", "source": "default", "location": "process cwd", "redacted": false },
    { "key": "harness", "source": "flag", "location": "--harness", "redacted": false },
    { "key": "transport", "source": "default", "location": "built-in", "redacted": false },
    { "key": "model", "source": "default", "location": "built-in", "redacted": false },
    { "key": "timeout", "source": "default", "location": "built-in", "redacted": false },
    { "key": "output", "source": "flag", "location": "--output", "redacted": false },
    { "key": "color", "source": "default", "location": "built-in", "redacted": false },
    { "key": "verbose", "source": "default", "location": "built-in", "redacted": false },
    { "key": "authProfile", "source": "default", "location": "built-in", "redacted": true }
  ],
  "readiness": "ready",
  "blockingError": null
}
