{
  "schema": "openprose.runner-dry-run-report/1",
  "wouldStartModel": false,
  "cwd": "{{WORKSPACE}}",
  "selection": {
    "harness": "prime",
    "transport": "rpc",
    "adapterId": "prime/rpc",
    "runtimeVersion": "prime-agent 0.7.0",
    "model": "fixture/model:alpha"
  },
  "prompt": { "placement": "system-append", "strictness": "strict" },
  "isolation": "partial",
  "auth": { "category": "harness-managed", "readiness": "unknown" },
  "billingOwner": "user-provider",
  "languageImage": {
    "formatVersion": "openprose.skill-runtime-image/1",
    "version": "sentinel-v1",
    "sha256": "ee13d1cbba24d1623523f4fe8747b4a3387cd6880f5d6fb4a360d2a7949ddf00",
    "releaseEligible": false
  },
  "configuration": [
    { "key": "cwd", "source": "default", "location": "process cwd", "redacted": false },
    { "key": "harness", "source": "flag", "location": "--harness", "redacted": false },
    { "key": "transport", "source": "flag", "location": "--transport", "redacted": false },
    { "key": "model", "source": "flag", "location": "--model", "redacted": false },
    { "key": "timeout", "source": "default", "location": "built-in", "redacted": false },
    { "key": "output", "source": "flag", "location": "--output", "redacted": false },
    { "key": "color", "source": "default", "location": "built-in", "redacted": false },
    { "key": "verbose", "source": "default", "location": "built-in", "redacted": false },
    { "key": "authProfile", "source": "flag", "location": "--auth-profile", "redacted": true }
  ],
  "readiness": "ready",
  "blockingError": null
}
